{
 "arm": "shadow:deepseek-backfill",
 "attempts": [
  {
   "cost_estimated": false,
   "cost_usd": 0.0,
   "returncode": 0,
   "secs": 0.6,
   "usage": {
    "input_tokens": 0,
    "output_tokens": 0
   }
  },
  {
   "cost_estimated": false,
   "cost_usd": 0.0,
   "returncode": 0,
   "secs": 0.6,
   "usage": {
    "input_tokens": 0,
    "output_tokens": 0
   }
  }
 ],
 "auth": "subscription",
 "base_ref_oid": "618dcba3081036febfa43a160d2e0f5a8c34f43f",
 "cost_estimated": false,
 "cost_usd": 0.0,
 "dedupe_key": "FormalFrontier/TauCeti|75|b54e89f7140c8f73ec5c884cce315fe86f641e2a|naming|deepseek/deepseek-v4-pro|e1aee6e8c6688dd8|shadow:deepseek-backfill|1",
 "diff_blob": "9530dea10de0eb9d278ac3082300af63b7247a547f4f2b23c1647e60f6953a32",
 "diff_sha256": "9530dea10de0eb9d278ac3082300af63b7247a547f4f2b23c1647e60f6953a32",
 "duration_s": 1.2,
 "fidelity": "exact",
 "findings": [],
 "head_sha": "b54e89f7140c8f73ec5c884cce315fe86f641e2a",
 "merge_base_sha": "618dcba3081036febfa43a160d2e0f5a8c34f43f",
 "mode": "manual",
 "model": "deepseek/deepseek-v4-pro",
 "pr": 75,
 "prompt_policy": "fresh",
 "prompt_sha256": "15803956436436b4baf02577792e4fdb3620c161877d5b4c9cacd2f6bafd8d1f",
 "provider": "deepseek",
 "repo": "FormalFrontier/TauCeti",
 "round": 1,
 "rubric": "naming",
 "rubrics_repo": "FormalFrontier/TauCetiReview",
 "rubrics_sha": "4ba876efaa230b44970ce5084f1a6c461a26f46e",
 "rubrics_version": "e1aee6e8c6688dd8",
 "run_id": "r-20260613T043024Z-75-naming-3ac9ff",
 "schema": "tauceti.run/v1",
 "source": "shadow",
 "started_at": "2026-06-13T04:30:24Z",
 "usage": {
  "input_tokens": 0,
  "output_tokens": 0
 },
 "verdict": "error"
}
