{
 "arm": "production",
 "attempts": [
  {
   "cost_estimated": true,
   "cost_usd": 0.058528,
   "returncode": 0,
   "usage": {
    "cached_input_tokens": 12032,
    "input_tokens": 41774,
    "output_tokens": 631,
    "reasoning_output_tokens": 289
   }
  }
 ],
 "base_ref_oid": "1c3cef564b6afa5d3f27e23c86ae5e6a555d9f24",
 "cost_estimated": true,
 "cost_usd": 0.058528,
 "dedupe_key": "FormalFrontier/TauCeti|100|828a71b1c5ecf64220f57fdaff15713b6d8d3e2c|naming|gpt-5.5|68ec685af806ec41|production|3",
 "fidelity": "reconstructed",
 "findings": [],
 "head_sha": "828a71b1c5ecf64220f57fdaff15713b6d8d3e2c",
 "mode": "commit",
 "model": "gpt-5.5",
 "pr": 100,
 "prompt_policy": "reactivation",
 "provider": "codex",
 "repo": "FormalFrontier/TauCeti",
 "round": 3,
 "rubric": "naming",
 "rubrics_repo": "FormalFrontier/TauCetiReview",
 "rubrics_version": "68ec685af806ec41",
 "run_id": "r-20260609T230344Z-100-naming-9cf92e",
 "schema": "tauceti.run/v1",
 "source": "backfill-ledger",
 "started_at": "2026-06-09T23:03:44Z",
 "summary": "Names introduced in this PR describe their conclusions in standard Mathlib style, and the prior `IsSymm` naming concern has been fixed. No gratuitous or unscoped notation is introduced.",
 "transcript_blob": "cdf574f80e9dde727a802801721afc0b2e89f1e128e13b734f8d39b389f12f48",
 "usage": {
  "cached_input_tokens": 12032,
  "input_tokens": 41774,
  "output_tokens": 631,
  "reasoning_output_tokens": 289
 },
 "verdict": "approve"
}
