{
 "arm": "shadow:deepseek-backfill",
 "attempts": [
  {
   "cost_estimated": false,
   "cost_usd": 0.059705,
   "returncode": 0,
   "secs": 220.0,
   "usage": {
    "input_tokens": 115429,
    "output_tokens": 10497
   }
  }
 ],
 "auth": "subscription",
 "base_ref_oid": "1099f3b5a435778fc581f977cf605c10292c7bf3",
 "cost_estimated": false,
 "cost_usd": 0.059705,
 "dedupe_key": "FormalFrontier/TauCeti|46|3fef29a6addb11d98b4c6c1f3efe358b09f9e8f1|naming|deepseek/deepseek-v4-pro|e1aee6e8c6688dd8|shadow:deepseek-backfill|1",
 "diff_blob": "c8d3ba61d1704c491c6d9a0bfb80d96db89cc2fbeceae69e49f874e2016c5e93",
 "diff_sha256": "c8d3ba61d1704c491c6d9a0bfb80d96db89cc2fbeceae69e49f874e2016c5e93",
 "duration_s": 220.0,
 "fidelity": "exact",
 "findings": [],
 "head_sha": "3fef29a6addb11d98b4c6c1f3efe358b09f9e8f1",
 "merge_base_sha": "1099f3b5a435778fc581f977cf605c10292c7bf3",
 "mode": "manual",
 "model": "deepseek/deepseek-v4-pro",
 "pr": 46,
 "prompt_policy": "fresh",
 "prompt_sha256": "934e32a1fcbf07d76cee536f8ce5a5efdc218e9a07e394817bc38d91d37962cc",
 "provider": "deepseek",
 "repo": "FormalFrontier/TauCeti",
 "round": 1,
 "rubric": "naming",
 "rubrics_repo": "FormalFrontier/TauCetiReview",
 "rubrics_sha": "59403d5471ff29d54e2a2781005539703a08567a",
 "rubrics_version": "e1aee6e8c6688dd8",
 "run_id": "r-20260613T035456Z-46-naming-03df57",
 "schema": "tauceti.run/v1",
 "source": "shadow",
 "started_at": "2026-06-13T03:54:56Z",
 "summary": "All names describe their conclusions in standard Mathlib terminology. The `apply*` pattern in HomeomorphAction.lean follows `Equiv.Perm.applyMulAction`/`applyFaithfulSMul` precedents. Deck-namespace lemmas (`mem_iff`, `mapsTo_fiber`, `fiberHomeomorph`, `smul_eq_apply`) are consistent with Mathlib conventions. No new notation is introduced and no name overstates its statement.",
 "transcript_blob": "0e227690dd249f8ea2b81b9471dff9bfb113d4d7e42639c55dd719af190d5ec6",
 "usage": {
  "input_tokens": 115429,
  "output_tokens": 10497
 },
 "verdict": "approve"
}
