{
 "arm": "shadow:deepseek-backfill",
 "attempts": [
  {
   "cost_estimated": false,
   "cost_usd": 0.0,
   "returncode": 0,
   "secs": 0.8,
   "usage": {
    "input_tokens": 0,
    "output_tokens": 0
   }
  },
  {
   "cost_estimated": false,
   "cost_usd": 0.0,
   "returncode": 0,
   "secs": 0.6,
   "usage": {
    "input_tokens": 0,
    "output_tokens": 0
   }
  }
 ],
 "auth": "subscription",
 "base_ref_oid": "1f1d7527e4085f3ac0ffad2ac3ad69cfbebe809c",
 "cost_estimated": false,
 "cost_usd": 0.0,
 "dedupe_key": "FormalFrontier/TauCeti|45|6a4a08fbd39f8481124b33599f93037c54eee7a0|naming|deepseek/deepseek-v4-pro|e1aee6e8c6688dd8|shadow:deepseek-backfill|1",
 "diff_blob": "9bd2c7497e6abb417f12ee6857597ad6588fc069cd2b3ea19be5ddb49888e411",
 "diff_sha256": "9bd2c7497e6abb417f12ee6857597ad6588fc069cd2b3ea19be5ddb49888e411",
 "duration_s": 1.5,
 "fidelity": "exact",
 "findings": [],
 "head_sha": "6a4a08fbd39f8481124b33599f93037c54eee7a0",
 "merge_base_sha": "1f1d7527e4085f3ac0ffad2ac3ad69cfbebe809c",
 "mode": "manual",
 "model": "deepseek/deepseek-v4-pro",
 "pr": 45,
 "prompt_policy": "fresh",
 "prompt_sha256": "7e2ba38525d947570b8d11360d5d5f7d805eb234258c58f81dbf54bdde56005a",
 "provider": "deepseek",
 "repo": "FormalFrontier/TauCeti",
 "round": 1,
 "rubric": "naming",
 "rubrics_repo": "FormalFrontier/TauCetiReview",
 "rubrics_sha": "59403d5471ff29d54e2a2781005539703a08567a",
 "rubrics_version": "e1aee6e8c6688dd8",
 "run_id": "r-20260612T112132Z-45-naming-837ab6",
 "schema": "tauceti.run/v1",
 "source": "shadow",
 "started_at": "2026-06-12T11:21:32Z",
 "usage": {
  "input_tokens": 0,
  "output_tokens": 0
 },
 "verdict": "error"
}
