{
 "arm": "shadow:deepseek-backfill",
 "attempts": [
  {
   "cost_estimated": false,
   "cost_usd": 0.0,
   "returncode": 0,
   "secs": 0.6,
   "usage": {
    "input_tokens": 0,
    "output_tokens": 0
   }
  },
  {
   "cost_estimated": false,
   "cost_usd": 0.0,
   "returncode": 0,
   "secs": 0.5,
   "usage": {
    "input_tokens": 0,
    "output_tokens": 0
   }
  }
 ],
 "auth": "subscription",
 "base_ref_oid": "618dcba3081036febfa43a160d2e0f5a8c34f43f",
 "cost_estimated": false,
 "cost_usd": 0.0,
 "dedupe_key": "FormalFrontier/TauCeti|60|90f1d9adc1be64354b10850298ef2fbdf391d3f7|correctness|deepseek/deepseek-v4-pro|e1aee6e8c6688dd8|shadow:deepseek-backfill|1",
 "diff_blob": "d9cbaea04d6f5fa4f60f7f64dd72435fa498fb6a1378faeab363c71d72afbd1b",
 "diff_sha256": "d9cbaea04d6f5fa4f60f7f64dd72435fa498fb6a1378faeab363c71d72afbd1b",
 "duration_s": 1.1,
 "fidelity": "exact",
 "findings": [],
 "head_sha": "90f1d9adc1be64354b10850298ef2fbdf391d3f7",
 "merge_base_sha": "618dcba3081036febfa43a160d2e0f5a8c34f43f",
 "mode": "manual",
 "model": "deepseek/deepseek-v4-pro",
 "pr": 60,
 "prompt_policy": "fresh",
 "prompt_sha256": "c449552b298011809d8f4bc411e8a25a4168daa7d944e7fc84c7a6356ff4ff00",
 "provider": "deepseek",
 "repo": "FormalFrontier/TauCeti",
 "round": 1,
 "rubric": "correctness",
 "rubrics_repo": "FormalFrontier/TauCetiReview",
 "rubrics_sha": "4ba876efaa230b44970ce5084f1a6c461a26f46e",
 "rubrics_version": "e1aee6e8c6688dd8",
 "run_id": "r-20260613T042911Z-60-correctness-5ce424",
 "schema": "tauceti.run/v1",
 "source": "shadow",
 "started_at": "2026-06-13T04:29:11Z",
 "usage": {
  "input_tokens": 0,
  "output_tokens": 0
 },
 "verdict": "error"
}
